{"approved_arms":["governed","ordinary"],"approved_case_ids":["H-TASK-001","H-TASK-002","H-TASK-003","H-TASK-004","H-TASK-005","H-TASK-006"],"approved_corpus_id":"sha256:fb0ee041f81c68ec97655c39564dc20e92c9b8f1cd490baf2b5ec06685c91533","approved_labels":{"H-TASK-001":"BLOCK","H-TASK-002":"BLOCK","H-TASK-003":"BLOCK","H-TASK-004":"BLOCK","H-TASK-005":"NO_BLOCKING_FINDING_OBSERVED","H-TASK-006":"NO_BLOCKING_FINDING_OBSERVED"},"decision_id":"sha256:961e15e9b42605a891be757083f0820c168a8239fdb77f717dce070e924c002d","decision_type":"paired_comparison_labels","expires_at":"2027-09-05T22:08:14Z","issued_at":"2026-09-05T22:08:14Z","issuer":{"assertion_sha256":"sha256:362acbac26f1b5b3505897441f7c16c335366d50a469fb5446d0467d6af2eeb2","authentication_method":"github-actions-workflow-dispatch","protected_source":"timaday/codex-governed-change@refs/heads/governance-authority","subject":"github:timaday"},"repository_id":"repo:timaday/codex-governed-change","schema_version":"1.0.0"}
